{
  "checkpoint_id":"CGEV2+-2026-09-01T1405",
  "timestamp":"2026-09-01T14:05:00+02:00",
  "repository":"rotprods/viral-carrousels-",
  "branch":"main",
  "head_sha":"c41ee2b1f5a6b65bf5e6884e301aecaacf81e935",
  "mission":"Harden continuity and execution control plane before zero-context migration to Module 02 autonomous AI video editing.",
  "state_change":true,
  "completed":[
    "Added authority graph",
    "Added zero-context recovery protocol",
    "Added capability audit schema",
    "Added session checkpoint schema",
    "Initialized decision register",
    "Initialized risk register",
    "Initialized append-only evidence ledger",
    "Added next-agent bootstrap",
    "Upgraded AGENTS.md to enforce recovery/evidence protocol"
  ],
  "verified":[
    "Module 02 boundary: Motion.OS/AVE are execution substrates, not curriculum",
    "Motion.OS durable state reports release blocked",
    "AVE durable status reports structural completion but remaining product/LLM validation gaps"
  ],
  "blocked":[
    "Motion.OS × AVE forensic capability audit not yet executed",
    "Minimum autonomous editing vertical slice not yet verified",
    "Module 02 learning outcomes intentionally not locked yet"
  ],
  "decisions":[
    "GitHub durable state beats conversation memory",
    "Module 02 course design gated by forensic capability audit",
    "Capabilities require evidence-backed status labels",
    "Exact-artifact testing required for release claims"
  ],
  "risks":[
    "Capability theater",
    "Local/repo/deploy divergence",
    "Pedagogy contaminated by infrastructure",
    "False QA confidence",
    "Temporal critic gap",
    "Overengineering recurrence",
    "Context-loss regression"
  ],
  "artifacts":[
    "control-plane/AUTHORITY_GRAPH.md",
    "control-plane/RECOVERY_PROTOCOL.md",
    "control-plane/CAPABILITY_AUDIT_SCHEMA.json",
    "control-plane/SESSION_CHECKPOINT.schema.json",
    "control-plane/DECISIONS.md",
    "control-plane/RISKS.md",
    "control-plane/EVIDENCE_LEDGER.jsonl",
    "control-plane/NEXT_AGENT_BOOTSTRAP.md",
    "AGENTS.md"
  ],
  "contradictions":[],
  "next_action":"Zero-context forensic recovery of rotprods/motion-OS and rotprods/ave, then construct an evidence-backed capability graph and minimum autonomous editing vertical slice.",
  "recovery_hint":"Start from control-plane/NEXT_AGENT_BOOTSTRAP.md and do not design the course until capability audit DoD passes."
}
