{
  "checkpoint_id": "CGEV2-HARDENED-2026-09-01T1448",
  "timestamp": "2026-09-01T14:48:00+02:00",
  "repository": "rotprods/viral-carrousels-",
  "branch": "main",
  "head_sha": "2f793cf825d8e8567c1fc009d8319d5cb08d51c7",
  "mission": "Elevate COS Graph Engine V2+ into a recoverable, evidence-gated control plane before Module 02 autonomous video editing work.",
  "state_change": true,
  "completed": [
    "Added canonical control-plane index and mutation contract",
    "Added staged autonomous editing benchmark gates G0-G6",
    "Added real-media autonomous editing vertical-slice gate",
    "Promoted GOAL.md to multi-module AI-native creative systems North Star",
    "Reconciled stale STATE.md with current forensic Module 02 gate",
    "Reconciled HANDOFF.md with zero-context CGEV2+ bootstrap",
    "Updated AGENTS.md to enforce benchmark and vertical-slice evidence gates",
    "Appended CGEV2+ changes to CHANGELOG.md",
    "Extended evidence/event ledger and explicitly avoided a duplicate generic event ledger"
  ],
  "verified": [
    "Durable Motion.OS state remains a blocked execution-substrate release claim requiring current forensic recovery",
    "AVE structural-completion/test-count status remains a documentation-backed claim requiring code/test/render corroboration",
    "Module 02 is not the Motion.OS or AVE syllabus",
    "Module 02 course artifact design is blocked until capability evidence and autonomous vertical-slice gates pass"
  ],
  "blocked": [
    "Motion.OS × AVE current capability matrix not yet completed",
    "Autonomous editing vertical slice not yet verified on real media",
    "Authoritative whole-video temporal critic and targeted repair path not yet demonstrated for integrated editing flow",
    "Module 02 learning outcomes not yet locked because execution capabilities are not yet reconciled"
  ],
  "decisions": [
    "Use EVIDENCE_LEDGER.jsonl as both canonical evidence and event stream; do not add redundant generic event ledger",
    "Architecture breadth, README claims and test counts cannot pass autonomous editing gates without rendered end-to-end evidence",
    "Do not design Module 02 HTML before forensic capability/vertical-slice gates"
  ],
  "risks": [
    "R-001 capability theater",
    "R-002 local/repo/deploy divergence",
    "R-004 false QA confidence",
    "R-005 temporal critic gap",
    "R-006 overengineering recurrence",
    "R-007 context-loss regression"
  ],
  "artifacts": [
    "control-plane/README.md",
    "control-plane/BENCHMARK_GATES.md",
    "control-plane/AUTONOMOUS_EDITING_VERTICAL_SLICE_GATE.md",
    "control-plane/AUTHORITY_GRAPH.md",
    "control-plane/RECOVERY_PROTOCOL.md",
    "control-plane/NEXT_AGENT_BOOTSTRAP.md",
    "control-plane/CAPABILITY_AUDIT_SCHEMA.json",
    "control-plane/EVIDENCE_LEDGER.jsonl",
    "GOAL.md",
    "STATE.md",
    "HANDOFF.md",
    "AGENTS.md",
    "CHANGELOG.md"
  ],
  "contradictions": [
    "Prior root STATE/HANDOFF described obsolete Module 01 bootstrap/Pages phase; reconciled in this checkpoint",
    "Historical local Module 01 final visual HTML may still differ from repo/public artifact; remains open risk rather than resolved claim"
  ],
  "next_action": "Forensically recover current Motion.OS and AVE repositories, populate the evidence-backed capability graph, and identify/prove the minimum autonomous editing vertical slice before any Module 02 training design.",
  "recovery_hint": "Begin at control-plane/README.md then control-plane/NEXT_AGENT_BOOTSTRAP.md. Treat this checkpoint head_sha as the pre-checkpoint parent; refetch main because writing this checkpoint advances HEAD."
}
